{
  "$schema": "./COLOR_PALETTE_schema.json",
  "version": "1.0.0",
  "name": "Rebecca Energy Color Palette",
  "description": "Cozy autumnal forest palette embodying twilight magic, whimsical yet grounded aesthetic for Human Design chart visualization",
  "philosophy": {
    "aesthetic": "Cozy autumnal forest, twilight magic, enchanted but accessible",
    "tone": "Warm and approachable, playful yet grounded",
    "themes": [
      "Deep purples: mystical, twilight, consciousness",
      "Gold/amber: autumn warmth, activation, energy",
      "Forest greens: grounded, natural, growth",
      "Earth tones: stability, foundation, presence"
    ]
  },
  "primary_palette": {
    "mystical_purple": {
      "name": "Mystical Purple",
      "description": "Deep twilight purple for consciousness, unconscious design activations, mystical elements",
      "hex": "#6B4E8B",
      "rgb": [107, 78, 139],
      "hsl": [269, 28, 43],
      "usage": ["unconscious_activations", "design_side", "mystical_elements", "twilight_themes"]
    },
    "twilight_deep": {
      "name": "Twilight Deep",
      "description": "Darker purple for shadows, depth, unconscious realms",
      "hex": "#4A3560",
      "rgb": [74, 53, 96],
      "hsl": [269, 29, 29],
      "usage": ["backgrounds_dark_mode", "undefined_centers_dark", "deep_unconscious"]
    },
    "twilight_light": {
      "name": "Twilight Light",
      "description": "Lighter purple for highlights, subtle mystical touches",
      "hex": "#9B7EBD",
      "rgb": [155, 126, 189],
      "hsl": [268, 33, 62],
      "usage": ["hover_states", "highlights", "subtle_mystical_elements"]
    },
    "autumn_gold": {
      "name": "Autumn Gold",
      "description": "Warm golden amber for conscious activations, personality side, energetic presence",
      "hex": "#D4A046",
      "rgb": [212, 160, 70],
      "hsl": [38, 63, 55],
      "usage": ["conscious_activations", "personality_side", "activation_highlights", "defined_centers"]
    },
    "autumn_amber": {
      "name": "Autumn Amber",
      "description": "Rich amber for electromagnetic connections, active channels, energy flow",
      "hex": "#C87D2F",
      "rgb": [200, 125, 47],
      "hsl": [31, 62, 48],
      "usage": ["active_channels", "electromagnetic_connections", "energy_flow", "channel_activation"]
    },
    "harvest_light": {
      "name": "Harvest Light",
      "description": "Soft golden glow for subtle warmth, hover states on conscious elements",
      "hex": "#E8C589",
      "rgb": [232, 197, 137],
      "hsl": [38, 67, 72],
      "usage": ["hover_conscious", "subtle_warmth", "light_backgrounds"]
    },
    "forest_green": {
      "name": "Forest Green",
      "description": "Grounded forest green for growth, stability, defined centers",
      "hex": "#4A7856",
      "rgb": [74, 120, 86],
      "hsl": [136, 24, 38],
      "usage": ["defined_centers", "growth_elements", "grounded_presence", "stable_energy"]
    },
    "moss_deep": {
      "name": "Moss Deep",
      "description": "Deep mossy green for backgrounds, grounding elements",
      "hex": "#344A3D",
      "rgb": [52, 74, 61],
      "hsl": [145, 17, 25],
      "usage": ["backgrounds_dark_mode", "grounding_elements", "subtle_borders"]
    },
    "sage_light": {
      "name": "Sage Light",
      "description": "Soft sage for undefined centers in light mode, gentle presence",
      "hex": "#9FB8A7",
      "rgb": [159, 184, 167],
      "hsl": [139, 15, 67],
      "usage": ["undefined_centers_light", "muted_elements", "gentle_backgrounds"]
    },
    "earth_brown": {
      "name": "Earth Brown",
      "description": "Warm earth brown for foundations, stability, grounding",
      "hex": "#7A5C4D",
      "rgb": [122, 92, 77],
      "hsl": [20, 23, 39],
      "usage": ["foundations", "stability_elements", "grounded_text", "borders"]
    },
    "bark_deep": {
      "name": "Bark Deep",
      "description": "Deep bark brown for text, strong grounding",
      "hex": "#4D3A2F",
      "rgb": [77, 58, 47],
      "hsl": [22, 24, 24],
      "usage": ["primary_text_light_mode", "strong_borders", "grounding_anchor"]
    },
    "sand_light": {
      "name": "Sand Light",
      "description": "Warm sandy beige for light backgrounds, gentle foundation",
      "hex": "#E8DDD0",
      "rgb": [232, 221, 208],
      "hsl": [33, 33, 86],
      "usage": ["backgrounds_light_mode", "subtle_surfaces", "gentle_foundation"]
    }
  },
  "semantic_mappings": {
    "human_design_concepts": {
      "conscious_personality": {
        "description": "Conscious activations (personality side, what we're aware of)",
        "primary_color": "#D4A046",
        "color_name": "autumn_gold",
        "secondary_color": "#C87D2F",
        "secondary_name": "autumn_amber",
        "rationale": "Warm golden tones represent conscious awareness, like sunlight illuminating what we can see"
      },
      "unconscious_design": {
        "description": "Unconscious activations (design side, what operates beneath awareness)",
        "primary_color": "#6B4E8B",
        "color_name": "mystical_purple",
        "secondary_color": "#4A3560",
        "secondary_name": "twilight_deep",
        "rationale": "Deep purples evoke twilight mysteries, the unconscious realm we're discovering"
      },
      "defined_centers": {
        "description": "Centers with consistent, reliable energy",
        "primary_color": "#4A7856",
        "color_name": "forest_green",
        "accent_color": "#D4A046",
        "accent_name": "autumn_gold",
        "saturation": "high",
        "rationale": "Saturated forest green shows strong, stable presence; gold accents show activation"
      },
      "undefined_centers": {
        "description": "Centers that are open, receptive to conditioning",
        "light_mode_color": "#9FB8A7",
        "light_mode_name": "sage_light",
        "dark_mode_color": "#4A3560",
        "dark_mode_name": "twilight_deep",
        "saturation": "low",
        "opacity": 0.6,
        "rationale": "Muted, softer tones show openness and receptivity rather than fixed energy"
      },
      "active_channels": {
        "description": "Channels connecting two defined centers",
        "primary_color": "#C87D2F",
        "color_name": "autumn_amber",
        "width": "bold",
        "rationale": "Rich amber shows energetic flow and electromagnetic connection"
      },
      "inactive_channels": {
        "description": "Channels without both gates activated",
        "light_mode_color": "#E8DDD0",
        "light_mode_name": "sand_light",
        "dark_mode_color": "#344A3D",
        "dark_mode_name": "moss_deep",
        "opacity": 0.4,
        "stroke": "dashed",
        "rationale": "Very subtle presence shows potential but not activation"
      },
      "gate_activations": {
        "description": "Individual gate activations (specific degrees)",
        "conscious_color": "#D4A046",
        "conscious_name": "autumn_gold",
        "unconscious_color": "#6B4E8B",
        "unconscious_name": "mystical_purple",
        "highlight_style": "dot",
        "rationale": "Clear differentiation between conscious (gold) and unconscious (purple) activations"
      }
    },
    "interaction_charts": {
      "person_a": {
        "description": "First person in interaction chart",
        "primary_color": "#D4A046",
        "color_name": "autumn_gold",
        "label_background": "#E8C589",
        "rationale": "Primary gold shows 'home' person or chart owner"
      },
      "person_b": {
        "description": "Second person in interaction chart",
        "primary_color": "#6B4E8B",
        "color_name": "mystical_purple",
        "label_background": "#9B7EBD",
        "rationale": "Purple differentiates second person, maintaining Rebecca Energy aesthetic"
      },
      "composite_overlap": {
        "description": "Where two people's energies create something new together",
        "primary_color": "#4A7856",
        "color_name": "forest_green",
        "blend_mode": "multiply",
        "opacity": 0.8,
        "rationale": "Green represents new growth from relationship alchemy"
      },
      "electromagnetic_connection": {
        "description": "Electromagnetic connections between charts",
        "primary_color": "#C87D2F",
        "color_name": "autumn_amber",
        "animation": "pulse",
        "rationale": "Amber energy shows live connection and flow between people"
      }
    },
    "transit_overlays": {
      "current_transits": {
        "description": "Current planetary transits overlaying natal chart",
        "primary_color": "#9B7EBD",
        "color_name": "twilight_light",
        "opacity": 0.7,
        "stroke": "dashed",
        "rationale": "Lighter purple shows transient cosmic weather over stable natal chart"
      },
      "transit_gates": {
        "description": "Gates activated by current transits",
        "primary_color": "#9B7EBD",
        "color_name": "twilight_light",
        "style": "outlined",
        "rationale": "Distinguished from natal activations while maintaining mystical theme"
      }
    }
  },
  "functional_colors": {
    "backgrounds": {
      "light_mode": {
        "primary": {
          "hex": "#F5F1EB",
          "rgb": [245, 241, 235],
          "name": "Soft Canvas",
          "usage": "Main background for light mode"
        },
        "secondary": {
          "hex": "#E8DDD0",
          "rgb": [232, 221, 208],
          "name": "sand_light",
          "usage": "Card backgrounds, secondary surfaces"
        },
        "elevated": {
          "hex": "#FFFFFF",
          "rgb": [255, 255, 255],
          "name": "Pure White",
          "usage": "Elevated cards, modals, overlays"
        }
      },
      "dark_mode": {
        "primary": {
          "hex": "#1C1410",
          "rgb": [28, 20, 16],
          "name": "Dark Earth",
          "usage": "Main background for dark mode"
        },
        "secondary": {
          "hex": "#2A211D",
          "rgb": [42, 33, 29],